product_id,page,page_order,recommended,date,bugType,haveBugs,invalidPositionOverTime,implementationResponseIssue,invalidContextOverTime,interruptedEvent,invalidEventOccurraceOverTime,actionNotPossible,actionWhenNotAllowed,informationOutOfOrder,lackOfRequiredInformation,invalidInfoAccess,objectOutOfBoundForAnyState,objectOutOfBoundForSpecificState,artificialStupidity,invalidValueChange,invalidGraphicalRespresentation,text,hours,username,products,early_access,products_ismissing
887570,2,6,TRUE,27-02-22,na,0,0,0,0,0,0,0,0,0,0,0,0,0,0,0,0,i guarantee i am going to put a thousand hours into this game okay but seriously this game scratches so many itches intense whiteknuckle tactical gameplay in a 3d space deep fleett customization mods battleships missiles and the most satisfying gut rumbling bass explosion when you pop an enemy ship and it explodes in a nuclear fire if the board game battleship  the expanse and then then ran away and raised the bastard baby with a retired naval officer that would be this game 1010 if you are a nerd the strategy genre finally finally has a great space game again,59.7,yungmomjeans,165,TRUE,FALSE
887570,2,7,TRUE,27-02-22,na,0,0,0,0,0,0,0,0,0,0,0,0,0,0,0,0,a phenomenal spacesim tactics game with enough realism and complexity to make the battles feel immersive and enough streamlining to make the game approachable,5.4,anataru,523,TRUE,FALSE
887570,2,8,FALSE,27-02-22,"invalid context state over time, lack of required information",1,0,0,1,0,0,0,0,0,1,0,0,0,0,0,0,i returned it 3d interface impossible to negotiate even looking at the side view then the top view the ship will not go where its indicated to go in the tutorial gamers say they want 3d until they get 3d if youre on the fence it will take more than 2 hours just to read the descriptions of all the modules much less complete the tutorial keep an eye on the clock,1.7,eddyvegas,325,TRUE,FALSE
1871830,2,0,TRUE,02-05-22,action not possible,1,0,0,0,0,0,1,0,0,0,0,0,0,0,0,0,amazing game start but would you be able to add maybe another room like a kitchen or another bedroom not trying to ask for anything big,35,flynnflynn11,93,TRUE,FALSE
1871830,2,1,TRUE,02-05-22,na,0,0,0,0,0,0,0,0,0,0,0,0,0,0,0,0,this game is really good i love the idea of a game that evolves with its community i think it would benifit with some kind of rotating feature so you cold place objects easier i also think some new interactive items like the piano would be pretty cool,20.7,bl1ndz,11,TRUE,FALSE
1871830,2,2,TRUE,02-04-22,action not possible,1,0,0,0,0,0,1,0,0,0,0,0,0,0,0,0,i played megalovania on the keyboard and somehow got on top of the bedframe with the help of a glitch i found twas fun my only critique is to make an main menu to help players exit the game more smoothly since this is early access just a continue and exit option would be nice edit i havent been able to close the game unless i close out steam itself i dont know what is causing this but i thought it would be good to let you know,5.8,fuhbreez,55,TRUE,FALSE
1659040,2,0,TRUE,03-01-22,"invalid context state over time, invalid value change",1,0,0,1,0,0,0,0,0,0,0,0,0,0,1,0,i can see why everybody is salty i beat the game in one night i liked the story and enjoy having a few more levels but i dont feel like it is worth a whole new game price the dlc setup is horrible to you get nothing for the prices no new maps just escalations thumbs down for now but i do hear of a new game mode coming lets hope it comes with a new map or two the final level should not count as a map at all because it is so linear i have also been stopped several times mid level because of connecting to hitman servers thats pretty bad considering its a single player game i am also hoping in the new game mode they come out with that there will be some intense cqc between 47 and the other assassins that may or may not be in the levels some jason bourne cqc would be really fun making the button qte events do actual moves and push the fight into other spaces rock paper scissors if you are a fan of the series the few new levels are pretty well done and still pretty large the final level is very linear and short so it shouldnt even count as a map id say get the game on sale and on that  note if its on sale i give it a thumbs up and if not thumbs down,6.9,barboatemous,420,FALSE,FALSE
1659040,2,2,FALSE,03-01-22,invalid context state over time,1,0,0,1,0,0,0,0,0,0,0,0,0,0,0,0,i finally got it for a decent discount and am enjoying it overall though the levels dont have as many missions as previous games but there are definitely some unique ones like dartmoor is the game worth id say no unless you get can get it on discount there are some technical issues i was stopped midgame multiple times so the game could connect to the servers it always went through but it was still annoying another big issue that plagues this game is the company behind it ioi has some shaddy business practices when it comes to their customers this game is not worth 60 because honestly it feels more like an expansion of 2 then it does a 3rd game,12.9,plunging v-neck,317,FALSE,FALSE
1659040,2,6,TRUE,03-01-22,na,0,0,0,0,0,0,0,0,0,0,0,0,0,0,0,0,the best in the series gameplaywise but overall the whole trilogy is as good as you can get when it comes to hitman genre,13.4,imperiumrome,120,FALSE,FALSE
1659040,2,7,FALSE,03-01-22,invalid context state over time,1,0,0,1,0,0,0,0,0,0,0,0,0,0,0,0,still requires you to play online on top of it i suddenly have massive technical issues with the connection i dont care if it is on my end or their the fact that you have to play online was their  idea form the start and it is still not fixed sorry ioi but you dont seem to care at all,10.9,billedtrain380,135,FALSE,FALSE
271590,2,3,TRUE,03-01-22,na,0,0,0,0,0,0,0,0,0,0,0,0,0,0,0,0,this is a really fun game with plenty to do with almost limitless replayability as long as u ignore the obvious lack of security and endless modders on gta online,155.3,davidboss21,18,FALSE,FALSE
203160,2,0,TRUE,28-02-22,na,0,0,0,0,0,0,0,0,0,0,0,0,0,0,0,0,a beautiful game the graphics and cutscenes are fun to watch the combat is fun and reasonably easy to learn as for the puzzles they werent easy to solve but they were fun to figure out definitely recommend if youre into adventure,13.3,friendly1ntrovertttv,19,FALSE,FALSE
203160,2,1,TRUE,28-02-22,invalid graphical representation,1,0,0,0,0,0,0,0,0,0,0,0,0,0,0,1,this game reimagined what tomb raider is and i was concerned but the graphics story and the decision to not shy away from the survialist theme won me over a bargain at the price in 2022 i would say the graphics are slowly showing their age but nothing major,11.3,lynchgotya,292,FALSE,FALSE
203160,2,3,TRUE,28-02-22,action when not allowed,1,0,0,0,0,0,0,1,0,0,0,0,0,0,0,0,the game didnt overstay its welcome the game plays like an action movie its very on rails and pretty predictable thats not a bad thing but there are times where i felt the game leaned into it a little too hard to its detriment the action sequences are enjoyable the set pieces and environments are stunning and really carry parts of the game there were multiple instances where the game would take control out of your hands to autopilot a section that you are very capable of traversing yourself or unceremoniously ending a big enemies life without your interaction which while it didnt happen a ton it was a little deflating when it did overall a pleasant experience,13.7,mistahzed,823,FALSE,FALSE
203160,2,4,TRUE,28-02-22,na,0,0,0,0,0,0,0,0,0,0,0,0,0,0,0,0,if youre a fan of the uncharted series this is for you as its definitely the source of inspiration a lot of platforming and freedom to explore the ability to upgrade weapons and get perks as you level up gameplay wise tomb raider may have a leg up on uncharted but when it comes to the story the visuals and level design uncharted is still the superior game,10.6,wratheffect,26,FALSE,FALSE
203160,2,6,TRUE,27-02-22,object out of bound for specific state,1,0,0,0,0,0,0,0,0,0,0,0,1,0,0,0,best in the reboot series even to this day the game still holds up and looks modern with the foundation engine great graphics  good voice acting great setting no dlss tressfx hinders nividia cards even to this day sometimes lara will jump to the left instead of vaulting up when climbing leading to death,12,that terrible biscuit,130,FALSE,FALSE
203160,2,7,TRUE,27-02-22,na,0,0,0,0,0,0,0,0,0,0,0,0,0,0,0,0,after playing through the game from start to finish i have to say that its a great start to a new trilogy that i only just got around to starting the game is written very well has compelling characters and features the weirdness we expect from a tomb raider game it is also an origin story for a new lara croft who goes from an innocent new university grad to a hardened adventurer who is determined to uncover the weird mysteries of the world her father told her about by the end of the game i had come to love the tight game play elements aiming and shooting with all her weapons was easy and fun upgrades were earned from adventuring and hard won fights that became very easy by the time i got to the final parts of the game the enemies use flanking tactics and will overwhelm you if you are not careful quick time events are littered throughout the game along with a few temples to venture into at your leisure the sound team did an amazing job with the music if the music cannot set the proper tone i cannot play the game and the musical score is very well done and very tonal for the setting of the adventure i would recommend anyone pick up this game and play if you like adventureaction titles it has plenty of action and a very good story as well,23.6,jubeifurei,257,FALSE,FALSE
