product_id,page,page_order,recommended,date,bugType,haveBugs,invalidPositionOverTime,implementationResponseIssue,invalidContextOverTime,interruptedEvent,invalidEventOccurraceOverTime,actionNotPossible,actionWhenNotAllowed,informationOutOfOrder,lackOfRequiredInformation,invalidInfoAccess,objectOutOfBoundForAnyState,objectOutOfBoundForSpecificState,artificialStupidity,invalidValueChange,invalidGraphicalRespresentation,text,hours,username,products,early_access,products_ismissing
203160,1,9,TRUE,01-01-22,invalid graphical representation,1,0,0,0,0,0,0,0,0,0,0,0,0,0,0,1,some clunkiness and the choice to go tressfx over nvidia hairworks definitely shows its age if they had just gone physx we could have 60 fps that isnt all over the place on 30xx hardware lol talking about 4k but it doesnt really perform better on 1080p either,39.3,vemira,115,FALSE,FALSE
1174180,1,0,FALSE,01-01-22,action not possible,1,0,0,0,0,0,1,0,0,0,0,0,0,0,0,0,this is more of a tv series than a video game there are a lot of care taken in world building character development and plot the game though is extremely scripted you must do everything exactly the way this game wants you to do it other wise its instant game over and reload from checkpoint,35,aierce,132,FALSE,FALSE
1174180,1,1,TRUE,01-01-22,na,0,0,0,0,0,0,0,0,0,0,0,0,0,0,0,0,i loved the game although online has now become 100 a cash grab but if youre willing to put up with a lot of grind it is an amazing game,482.8,purp1edinosaur,14,FALSE,FALSE
204100,1,7,TRUE,01-01-22,action not possible,1,0,0,0,0,0,1,0,0,0,0,0,0,0,0,0,this game is too much fun in the way you get kill the time delayed feature is make this more fun and enjoyable but one thing is too bad about this game is you have to on rockstar launcher in your taskbar and also you have to connected in online otherwise you cant play this game,4.5,prithish das,56,FALSE,FALSE
221040,1,1,TRUE,01-01-22,"action not possible, invalid event occurance over time ",1,0,0,0,0,1,1,0,0,0,0,0,0,0,0,0,having spent quite a bit of time back on the ps3 this game is ironically one of my favorites of the series i really like the enhanced movement control options and various features such as the quick shot melee combat and countering capabilities however while the story was neatly layed out from different perspectives the game lacked everything associated with its survival horror roots the lack of weapon customization that was featured in re4 and 5 was a let down but was more than compensated with various melee combat options and countering capabilities the little customization that the player has is in setting up eight different triplets of skill slots that they purchase and upgrade skills throughout multiple runs of the game these were nice but i wish there was room for just one more due to the difficulty in escaping from various enemy grab attacks as far as weapons go each story includes various weapons that are acquired throughout the first playthrough and remain unlocked after that the use of grenades has also been mapped much better to quickly and efficiently get to and use than in the other games another great enhancement is the dying status being upgraded from the way it was in re5 that allows the player to defend and escape death without aid though at a disadvantage the overall presentation of the game was very well done and had very good graphics the levels were in some cases less enjoyable the way they trapped you in a smaller section at a time and blocked the ability to backtrack one of the most annoying aspects of the game was the interactive movie events or at least some of them that wants to cause great wear and tear to the controller to pull off in the limited time the last complaint would be in the numerous achievements that are attached to the various verses modes that few likely played to begin with given that resident evil has always been a singleplayer coop game overall the game is stylish and fun and the pc port seems to run perfectly fine the gameplay is more action oriented and less survival horror but the movement and combat options are in my opinion the best this franchise has ever featured in any of their games if you like these games then you will likely enjoy this one for the game it is however if it must be survival horror then you may be let down by this one,33,karythar,155,FALSE,FALSE
221040,1,3,TRUE,01-01-22,na,0,0,0,0,0,0,0,0,0,0,0,0,0,0,0,0,honestly re6 is a very fun coop game with another friend to play with yeah it drops the horror aspect of the game but man is it fun,7.9,nsaneqtip,153,FALSE,FALSE
221040,1,4,TRUE,01-01-22,na,0,0,0,0,0,0,0,0,0,0,0,0,0,0,0,0,another resident evil title that was released with another strain of virus unleashed but now the zombies have became smart and theres a new character joined the fray jack muller albert weskers son the player will get to experience his story along with our favorite chris redfield leon s kennedy and ada wong in a story shrouded in mystery betrayal and brotherandsister love the events of this title goes like this the president of the united states thanks to a man who was working for neo umbrella called derek simmons where he unleashed a virus with the help of a clone of a character called ada wong ever felt that someone has been using your loved ones as a collateral for them to get what they want  did you ever experience that your best friends always got your back in situations so dire that you dont wish it would happen to your worst of enemies  cause thats what happened to leons partner and chriss team chriss partner piers nivans sacrificed his life to save chriss and leons partner helena harper had her sister kidnapped and used as a collateral to kill the president,71.5,ahmedyasser212001,179,FALSE,FALSE
221040,1,6,TRUE,01-01-22,na,0,0,0,0,0,0,0,0,0,0,0,0,0,0,0,0,i dont know why people hate this game this game is the way resident evil shouldve continued as its chaotic action and graphics with an amazing story and freestyle gameplay is awesome best game after re4 i would say that game is the best re ive ever played hope re4 remake come soon,2.6,pan-ji-karan,68,FALSE,FALSE
221040,1,7,TRUE,01-01-22,artificial stupidity,0,0,0,0,0,0,0,0,0,0,0,0,0,1,0,0,as soon as i entered the game the game jumped into action i was really surprised and i couldnt leave it the game might be the best re game ive played but it has features that i am scabies at for example the side character walking next to us hes running around like a fool the zombie attacks and does not even react to it we will go and save it when the zombies attack the survival games are very simple but i loved the action i give it 107,4,emrevitus,438,FALSE,FALSE
225540,1,1,TRUE,01-01-22,na,0,0,0,0,0,0,0,0,0,0,0,0,0,0,0,0,i highly recommend this game it is a lot of fun and it can entertain you for a long period of time even when you finish the gamestory it doesnt matter if you are playing it alone or with friends i recommend this game for all ages only minus is that it doesnt have a great story but the gameplay covers it up,57.5,bgi,3,FALSE,FALSE
225540,1,2,TRUE,01-01-22,na,0,0,0,0,0,0,0,0,0,0,0,0,0,0,0,0,absolutely love it the graphics the means of transportation the guns everything in the game is so well made,28.6,zakida,5,FALSE,FALSE
225540,1,6,FALSE,01-01-22,na,0,0,0,0,0,0,0,0,0,0,0,0,0,0,0,0,i give the grapple hook a 1010 i give the game a 210 i dont regret buying this game but im not going to finish it  you square enix,13.7,nan,68,FALSE,FALSE
225540,1,7,TRUE,01-01-22,na,0,0,0,0,0,0,0,0,0,0,0,0,0,0,0,0,good no amazing game super good graphics view points and it is in between chill gameplay and chaos and it has tanks planes bombs planes with bombs and boats guns boats with guns and well i can keep going on and on and on so just get the game  you missile,59.1,firehide256,13,FALSE,FALSE
1144200,2,4,TRUE,03-01-22,na,0,0,0,0,0,0,0,0,0,0,0,0,0,0,0,0,are you ready or not hehehehhahahdfhasdfhnsafhsahjfbsahjbfabwahahahahahahahahahaah bwahahaha awbwah wabwahawh awh ashhsafhas hashashahahaahahahahehehehehaeheeeheeeheeeheeeehahahahahahahabawhabhwwbaahwbawhawbwahdbhawfbhasdfbnashjfrbbuweijkhgsdrolghjrsdoi ghjreopasikhg ln dsfpkih dnsfgpikdfhn golidsfkh jgndsloja uhngolsd ahgnasdoli hnahahahahahahahahahahaahahahahahahahahhahahaahahahahahhahahaahahahahahahahahahahahahahahahaha,1.5,lukke,100,TRUE,FALSE
108600,2,3,TRUE,03-01-22,na,0,0,0,0,0,0,0,0,0,0,0,0,0,0,0,0,learning to play is quite the adjustment but once youre past that small hurdle project zomboid is an excellent game prepare to suffer and die many times while also watching your friends suffer and die in horrific unspeakable ways enjoy the anxietyattack that is leaving your house to find foodcigarette lighterbed sheetssledgehammergas cantrash bagetc  everything you once took for granted before the zombies took it all away from you weep silently as you find yourself stripping boxers bras speedos and panties from the undead youve defeated so that you can craft sheet ropes or otherwise use these garments to bandage your wounds and last but certainly not least prepare to feel the sinking pit in your stomach as the dreaded queasy moodle appears on your screen announcing that the scratch or laceration youve recently acquired is slowly turning you into one of the undead may your suffering be sweet,29.3,the lady of pain,42,TRUE,FALSE
108600,2,6,TRUE,03-01-22,implementation response issue,1,0,1,0,0,0,0,0,0,0,0,0,0,0,0,0,want a hardcore survival game this is it down to even the detail of washing your long socks this has it all and plans on more i dont have any complaints the only bad reviews ive seen are about slow development which i dont mind because the current game is an 1110 plan to fail and die a lot but with friends its hard to go wrong with this game even if your friends dont want to buy it theres remote play together too game allows custom maps there is currently no hunting but there is trapping and fishing hunting is the next addition if i am correct there is also mods if the base game is missing anything such things being ranged weapons other than guns bows digging wells even more realism in some areas etc,47.9,rogue45,23,TRUE,FALSE
108600,2,7,TRUE,03-01-22,na,0,0,0,0,0,0,0,0,0,0,0,0,0,0,0,0,great game like the realism and the mechanics implemented just wish multiplayer time skip was a thing,58.6,medieval peasant,72,TRUE,FALSE
108600,2,9,TRUE,03-01-22,na,0,0,0,0,0,0,0,0,0,0,0,0,0,0,0,0,its a great way to portray a semi realistic post apocalyptic environment  its a great game all the way around once you get the controls down,115.5,igortheloved,6,TRUE,FALSE
1086940,2,0,FALSE,28-02-22,na,0,0,0,0,0,0,0,0,0,0,0,0,0,0,0,0,just wait until 2040 when the full game is released no reason to spend the money they want you to for 2 hours of content,26.5,raise hell praise dale,55,TRUE,FALSE
1086940,2,2,TRUE,28-02-22,na,0,0,0,0,0,0,0,0,0,0,0,0,0,0,0,0,i enjoy the choice based mechanics and role play ability of the game still has some bugs but well worth,26.6,dragonickid,29,TRUE,FALSE
1086940,2,3,TRUE,28-02-22,na,0,0,0,0,0,0,0,0,0,0,0,0,0,0,0,0,convinced my friend to buy early access back in oct 2020 we beat act 1 and had a lot of fun the other day he asked if the game was done or they added a new actyikes,42.6,tiltedcoffee,43,TRUE,FALSE
1086940,2,4,TRUE,28-02-22,na,0,0,0,0,0,0,0,0,0,0,0,0,0,0,0,0,its great and has been progressively getting better larian has the unenviable task of having to try and balance dnd 5e while also just making a good job and theyve been doing better than i expected on both fronts excited for the full release,44.7,abehr1,60,TRUE,FALSE
1086940,2,7,TRUE,28-02-22,"artificial stupidity, invalid value change, invalid info access",1,0,0,0,0,0,0,0,0,0,1,0,0,1,1,0,very very good gameplay and lorewise the optimisation on the other hand still needs a lot of work my playthrough end 910 times because of a crash which sucks considering there is barely any autosave so im constantly having to redo battles and rediscover which is definately annoying some bugs here and there too but for the most part this game is solid even in early access,31.8,carnage,227,TRUE,FALSE
1086940,2,8,FALSE,28-02-22,lack of required information,1,0,0,0,0,0,0,0,0,1,0,0,0,0,0,0,this game has such great potential and it is probably going to be a dd classic the likes we havent seen since the 90s   thats if it actually does get launched  its been almost 2 years since it went ea and to be honest  outside of a few classes being added there hasnt been much movement  i mean your max level is 4 and you still havent produced all the classes   modders have mods they have made and left due to it getting old that work perfectly that both give you a max level of 20 and add all the classes  these are modders for goodness sakes and they are making the developers look like slackers  if this was an indie developer and it was their first attempt at a triple a game then i would say take all the time you need  but this developer has 2 cash cows on their resume that are still spewing money   do i want a rushed product of course not  but this is not a development team learning the ropes for the first time  they have proven skills and team members   this is also not their first rodeo  had this been a genre they they are attempting for the first time then yes a long development process would be understandable to put this in laymans terms its like chevrolet saying they need more time as they are having issues on figuring out how to make a car now if it was a boat or airplane i would understand  but its another car and not only that its a model you have been making for years now and only need to expand on what you have built in the past once the game finally goes live i am sure this will get changed to a thumbs up   but for now i just cant recommend anyone spending money on it  i am sure larians bank account will not notice so go spend that cash on an indie developer that could use it and has proven they love what they are building   example solasta  dd ruleset  max lev 12 and still more to come and it has the ability for you to create your own adventures as dd was meant to be,38.4,devinous,433,TRUE,FALSE
1826960,2,0,FALSE,22-02-22,"action not possible, artificial stupidity",1,0,0,0,0,0,1,0,0,0,0,0,0,1,0,0,trip in another world is a fairly unique take on the clash of clans genre with idler gacha elements but less focused on constant pvpterritorial warmongering and more towards cooperative gameplay mainly with your alliance members the game itself is pretty boxstandard the game frontloads you with tons of resources to get your city and army started quickly and slows down considerably after a few hours of intensive clicking however at its current state i cannot in good faith recommend it firstly the game appears to be a lazy mobile game port of the title lord of the other world its a literal carbon copy of it with little to no discernible difference however there is zero optimisation made to improve the pc experience every single action is performed with just your mouse essentially acting as a glorified finger as such some actions are quite annoying to perform like having to click and drag your mouse to scroll etc something that could be easily fixed by introducing keyboard shortcuts but alas there is also ui bloat which is fairly typical of mobile port you also cannot change the game resolution again alluding to the lazy port i mentioned earlier the only game settings you can change is language partially music and sound secondly a severe lack of easily accessible information about the game the translation itself is not very good resulting in some awkwardinconsistent translations in several aspects of the game like skill descriptions etc which can result in very confusing descriptionsexplanations in the tooltip this is further exacerbated by the game having a ton of different mechanics such as status effects like vertigo ridicule arms restraint what are the differences between the different types of healing bloodsucking treatment first aid etc the different types of basic attacks like detonation pierce strike etc just to name a few yet none of it is explained anywhere about what it does and how it works so youre just left to do a best guess of what it does and hope that your guess is right thirdly there is no confirm button for gem purchases if you accidentally click on something that costs gems usually accidentally because navigating the ui is torture your gems will just be consumed with completely no option to toggle a confirmation window overall the game is alright typical of a idle gacha with strategy elements built in there arent any predatoryaggressive microtransactions either for now however the game in its current state needs a lot more polish particularly for points 2 and 3 unless those gets fixed and the overall pc experience is optimised i cannot recommend it as of yet,84.8,chaoticderpy,1286,TRUE,FALSE
1826960,2,1,TRUE,21-02-22,"lack of information, invalid graphic representation",1,0,0,0,0,0,0,0,0,1,0,0,0,0,0,1,well if you ask me its not really that bad but it needs a lot of polishing i suggest this game if you like playing games like rise of kingdoms on mobile phone this game is almost like rise of kingdom exactly but they were a little bit more innovative in terms of some base content and best part its on pc but it feels like a phone game to be really honest what this game need to improve are hotkeys hotkeys are almost not present in this game which is really annoying as you have to click using your mouse to do everything so i really hope in the future it will add more hotkeys so that playing the game feels more easier and using the keyboard way more more rather than the mouse since its a pc game not a mobile game the only hotkey i found in this game was esc which when you press it it will ask you whether you want to exit the game or not warnings this game have an economy called gems which is to buy speedups and some other good stuff but its quite hard to get but its earnable so sometimes its really annoying is that if you accidentally press something that require gems and it does not give you a single warning to confirm that purchase so rip gems that you have been saving i really hope they add a confirmation button so that we dont mistakenly press and feel depressed about it optimization within the city it feels alright for the most part and pretty smooth i would say the problem that i find was that the layout mode its very hard to arrange your things nicely and in order because the grid that they provide is hardly accurate so i hope it will be more accurate in the next few updates so that arranging things would be much easier  now outside of the city i dont like the path of our troops  when we set them out as they cant go sideways but only left right straight or backwards which is pretty old school and doesnt really feel good at all one more thing that i must emphasis on is the zoom in and out key i wish that you could add the feature that we can use our mouses scroll wheel to zoom in and out this is really annoying because i always have to use my touch pad on my laptop and the sensitivity is very low i also hope you could let us zoom out into our field and the world easier so dont have to tap the button always to go out of our city i also suggest adding more settings options to make game play experience better and suit our liking as the settings we ahve right now is very limited graphics okay graphic wise withing the city can be better but its already great enough and im satisfied enough with the graphics within the city only but when you go outside of the city i feel that the objects are a bit oversize and does not look very good i do hope you improve on it your character graphics are spot on 5star for it but when we set them out they dont look really great and the troops they are leading are very plain and look very unmotivated needs improvement on that as well and hope the characters look as good as the picture showsthe world map feels like its 2d but i hope itll become 3d  so its much much much nicer animations this is the worst part i would say the animations its either its ugly or none at all i hope in the future you would make better animations especially on our character skills the movement of our troops feels very awkward as well maybe because they are really oversize on the map i hope more effect will be added on to the game so that the game feels much more exiting and makes me want to play even more i understand it was a mobile game before but now your trying to port over to pc which i will give my full support on because ive been waiting for this kind of game on this pc for the longest time but i would suggest making a whole different feel because pc can handle and use more ram than phone even phone nowadays can handle as much ram as a pc can so i dont see why not upgrade the graphics and animation to a whole new level tutorials tutorial feel like a job that was in a rush the explanation was not very clear and a misclick could end up missing a chat bubble which is required to understand it better i hope more clearer explanation and guidance is put into the game so more players can experience  a wonderful time extras overall a pretty good game i do really hope and wish that this game will become something like rise of kingdom which have good graphics good animation good optimization nice feel nice mechanics and and most importantly great content i dont know what will this game become in the future but i will be playing till it becomes one of the games that i have ever played i do suggest rebuilding it on unreal engine 5 to make it better graphically and better optimize do advertise this game as well because i think its need a lot more populations but its still on early access so i dont blame developers on anything hope you guys keep up the good work and focus more resources on this game because i personally think itll be a great game,6.4,i am cfj,6,TRUE,FALSE
1826960,2,2,FALSE,21-02-22,"action not possible, artificial stupidity, lack of required information",1,0,0,0,0,0,1,0,0,1,0,0,0,1,0,0,crappy chinese mobile game with all the bad things that entails unskippable tutorial despite the game being just like every other damn chinese mobile game personally i also found the voice of the tutorial guide incredibly annoying and despite steam saying it has full english audio it most certainly does not if you feel like playing something youve played a thousand times before but with different visuals then this game might be for you personally i wouldnt recommend it to my worst enemy,0.1,fallion,248,TRUE,FALSE
1826960,2,3,TRUE,21-02-22,action not possible,1,0,0,0,0,0,1,0,0,0,0,0,0,0,0,0,i want to be able to move house because at first the city plan was not thought of carefully after playing for a while there was a city plan in mind so i wanted it to be movable after it was built,1.9,akizao,4,TRUE,FALSE
1826960,2,4,TRUE,21-02-22,na,0,0,0,0,0,0,0,0,0,0,0,0,0,0,0,0,yea its fun wish there where more english talk in the chat  but it keeps me busy and i dont have to go though  google play updated after 60 hours i can say its a good game it will be very long as some of the buildings i see at the end game will take a month to build without speedups you are rewarded very often for doing quests etc lots to do in the game and your alliance will be very good in your progression you can mine gems food stone iron etc etc worth a go its free,107.1,menatwork,137,TRUE,FALSE
1826960,2,5,TRUE,20-02-22,na,0,0,0,0,0,0,0,0,0,0,0,0,0,0,0,0,so i was a catgirl commander and i had over 6000 troops caw caw thats cool caw caw wont help you clap cheeks with anyone in real life caw caw but that is neat caw caw,0.1,annoying crow,1245,TRUE,FALSE
1826960,2,9,TRUE,19-02-22,na,0,0,0,0,0,0,0,0,0,0,0,0,0,0,0,0,the game is highly addictive good to chuck on your monitor and watch something on another while you play and just idle the gameplay mechanics feel fun and i also find it quite satisfying to level up for f2p players from my experience so far its quite fair to move through the game drop rates for more advanced heroes are good so you wont feel like youre too behind people chucking money in as long as youre willing to put in the hours and research whats best to do its still very early days but it definitely feels like theres potential here,30.8,jamie,52,TRUE,FALSE
887570,2,1,TRUE,27-02-22,na,0,0,0,0,0,0,0,0,0,0,0,0,0,0,0,0,i will recommend this game to anyone who enjoys being able to customize fleets of ships and just anyone in general while controls are definitely hard to get used to you can also just spectate your fleets of ships battling it out in a single player skirmish out of 15 plus games i have bought in the past about ships and customization aspects this tops it by far not a single game even comes close to how enjoyable this game is even if you only watch it 1010 this game will set the bar for any game i want to purchase in the future i have nothing else to say about this game even for some slight criticism in game aspects its perfect,32.8,hoffkilla,43,TRUE,FALSE
887570,2,2,TRUE,27-02-22,na,0,0,0,0,0,0,0,0,0,0,0,0,0,0,0,0,1010 do not want to be recruited by the navy anytime soon its like i can hear them knocking on my door,30.6,jxuyski,14,TRUE,FALSE
887570,2,4,TRUE,27-02-22,na,0,0,0,0,0,0,0,0,0,0,0,0,0,0,0,0,i have a plan to fully give up any ambition i have in life and turn all my efforts into playing this game i have a poop computer which can actually run this masterpiece on low graphics im looking out of my window the skies are blue the weather is warm and perfect birds are chirping im about to fire up a few ships and not give a fck about any of that stuff that makes my life wholesome,2.7,loris16148,18,TRUE,FALSE
